{
    "$schema": "http://json-schema.org/draft-07/schema",
    "$id": "kendo-html://schemas/kendo-html-spec.json",
    "title": "Schema definition for Kendo UI HTML Specification",
    "description": "The HTML specification schema for Kendo UI",
    "type": "object",
    "$definitions": {
        "component-state": { "$ref": "./component-state.schema.json#/definitions/component-state" },
        "component-option": { "$ref": "./component-option.schema.json#/definitions/component-option" },
        "component-child": { "$ref": "./component-child.schema.json#/definitions/component-child" }
    },
    "properties": {
        "title": {
            "description": "Title of the HTML spec file",
            "type": "string"
        },
        "component": {
            "description": "Name of the component",
            "type": "string"
        },
        "selector": {
            "description": "The selector/s that can target the component",
            "type": "array",
            "minItems": 1,
            "items": {
                "type": "string"
            }
        },
        "states": {
            "description": "Describes the component states",
            "type": "array",
            "items": {
                "$ref": "#/$definitions/component-state"
            }
        },
        "options": {
            "description": "Describes the component options",
            "type": "array",
            "items": {
                "$ref": "#/$definitions/component-option"
            }
        },
        "children": {
            "description": "Describes the component children",
            "type": "array",
            "items": {
                "$ref": "#/$definitions/component-child"
            }
        }
    },
    "required": [
        "$schema",
        "title",
        "component",
        "selector"
    ]
}
